<?xml version="1.0" encoding="UTF-8"?>
<!DOCTYPE pattern SYSTEM "TreePattern053.dtd">
<pattern>
  <all>
    <attr>action</attr>

    <one>
      <attr>nick</attr>

      <all>
        <attr>x</attr>
        <attr>y</attr>
        <attr>z</attr>
      </all>
    </one>
  </all>
</pattern>
