<?xml version="1.0" encoding="UTF-8" standalone="no"?>
<!DOCTYPE patterns SYSTEM "TreePattern053.dtd">
<patterns>
  <pattern>
    <all>
      <one>

        <key flag="show_help" name="help" />
        
        <key flag="show_version" name="version" />

        <some flag="perform_action">

          <!-- ignote option and set assert if present -->
          <alias attr="u" validationAssert="deprecated" valuePattern="/(?!)/" />

          <!-- translate long options to its short versions -->
          <alias attr="number-nonblank">
            <attr>b</attr>
          </alias>

          <alias attr="show-ends">
            <attr>E</attr>
          </alias>

          <alias attr="number">
            <attr>n</attr>
          </alias>

          <alias attr="squeeze-blank">
            <attr>s</attr>
          </alias>

          <alias attr="show-tabs">
            <attr>T</attr>
          </alias>

          <alias attr="show-nonprinting">
            <attr>v</attr>
          </alias>

          <!-- expand aggregative options -->
          <alias attr="show-all">
            <attr>v</attr>
            <attr>E</attr>
            <attr>T</attr>
          </alias>
          
          <alias attr="A">
            <attr>v</attr>
            <attr>E</attr>
            <attr>T</attr>
          </alias>

          <alias attr="e">
            <attr>v</attr>
            <attr>E</attr>
          </alias>

          <alias attr="t">
            <attr>v</attr>
            <attr>T</attr>
          </alias>

          <!-- allowed short options -->
          <key name="b" />
          <key name="E" />
          <key name="n" />
          <key name="s" />
          <key name="T" />
          <key name="v" />
        </some>  

      </one>
    </all>
  </pattern>
</patterns>
