<?xml version="1.0" encoding="UTF-8"?>
<!DOCTYPE pattern SYSTEM "TreePattern053.dtd">
<pattern>
  <one>

    <attr>-h</attr>
    <attr>-v</attr>

    <some>
      <attr>-c</attr>
      <attr>-l</attr>
    </some>

    <attr>-a</attr>

  </one>
</pattern>
